{
  "schemaVersion": 2,
  "lessonId": "rtest",
  "title": "RTest",
  "hands": [
    "left",
    "right"
  ],
  "coordinateConvention": "wrist-relative",
  "angleUnit": "degrees",
  "positionUnit": "meters",
  "steps": [
    {
      "id": "step-01",
      "instruction": "Match pose 1",
      "mode": "hold",
      "holdMs": 700,
      "durationMs": 800,
      "hands": {
        "left": {
          "targetAngles": {
            "thumb": [
              22.6,
              18.8
            ],
            "index": [
              86.1,
              96.6,
              26.3
            ],
            "middle": [
              68.1,
              97.0,
              51.9
            ],
            "ring": [
              80.3,
              100.3,
              34.9
            ],
            "pinky": [
              71.7,
              91.3,
              43.9
            ]
          },
          "joints": [
            [
              0.0,
              0.0,
              0.0
            ],
            [
              0.0217,
              -0.0101,
              0.0304
            ],
            [
              0.0405,
              -0.0124,
              0.053
            ],
            [
              0.0502,
              -0.01,
              0.0815
            ],
            [
              0.0568,
              0.0019,
              0.1094
            ],
            [
              0.0163,
              -0.0042,
              0.0942
            ],
            [
              0.0057,
              -0.0222,
              0.0967
            ],
            [
              0.0192,
              -0.0295,
              0.0762
            ],
            [
              0.0352,
              -0.0245,
              0.0507
            ],
            [
              -0.0,
              0.0,
              0.0966
            ],
            [
              -0.0082,
              -0.0211,
              0.1057
            ],
            [
              -0.0016,
              -0.0301,
              0.0823
            ],
            [
              0.0187,
              -0.0198,
              0.064
            ],
            [
              -0.0131,
              0.0016,
              0.0964
            ],
            [
              -0.0234,
              -0.02,
              0.0995
            ],
            [
              -0.0127,
              -0.0231,
              0.0737
            ],
            [
              0.0034,
              -0.0148,
              0.0578
            ],
            [
              -0.0316,
              -0.0042,
              0.083
            ],
            [
              -0.031,
              -0.0188,
              0.0877
            ],
            [
              -0.0239,
              -0.0224,
              0.0742
            ],
            [
              -0.0149,
              -0.0161,
              0.0656
            ]
          ],
          "wristRotation": [
            -0.6896,
            -0.6593,
            -0.1729,
            0.2446
          ]
        },
        "right": {
          "targetAngles": {
            "thumb": [
              23.1,
              29.9
            ],
            "index": [
              77.0,
              87.5,
              37.7
            ],
            "middle": [
              72.9,
              94.9,
              27.3
            ],
            "ring": [
              76.3,
              101.3,
              7.2
            ],
            "pinky": [
              78.2,
              83.3,
              45.6
            ]
          },
          "joints": [
            [
              0.0,
              0.0,
              0.0
            ],
            [
              -0.0165,
              -0.0129,
              0.0339
            ],
            [
              -0.0306,
              -0.0253,
              0.0529
            ],
            [
              -0.042,
              -0.0336,
              0.0884
            ],
            [
              -0.0635,
              -0.0329,
              0.1103
            ],
            [
              -0.0163,
              -0.0054,
              0.0995
            ],
            [
              -0.0087,
              -0.0314,
              0.1057
            ],
            [
              -0.0128,
              -0.041,
              0.0763
            ],
            [
              -0.0237,
              -0.0302,
              0.045
            ],
            [
              0.0,
              0.0,
              0.0938
            ],
            [
              0.0015,
              -0.03,
              0.103
            ],
            [
              -0.0038,
              -0.0358,
              0.0769
            ],
            [
              -0.0149,
              -0.0284,
              0.0475
            ],
            [
              0.0158,
              -0.0038,
              0.0854
            ],
            [
              0.0191,
              -0.0337,
              0.0908
            ],
            [
              0.0109,
              -0.0339,
              0.0666
            ],
            [
              0.0021,
              -0.0306,
              0.0407
            ],
            [
              0.0275,
              -0.0054,
              0.072
            ],
            [
              0.0262,
              -0.0254,
              0.0754
            ],
            [
              0.016,
              -0.0305,
              0.0569
            ],
            [
              0.0114,
              -0.02,
              0.0392
            ]
          ],
          "wristRotation": [
            -0.7348,
            0.6605,
            0.0237,
            0.1526
          ]
        }
      }
    },
    {
      "id": "step-02",
      "instruction": "Match pose 2",
      "mode": "hold",
      "holdMs": 700,
      "durationMs": 4488,
      "hands": {
        "left": {
          "targetAngles": {
            "thumb": [
              20.5,
              43.3
            ],
            "index": [
              -18.8,
              5.5,
              39.0
            ],
            "middle": [
              -23.0,
              27.4,
              5.3
            ],
            "ring": [
              -11.2,
              21.1,
              12.8
            ],
            "pinky": [
              -18.6,
              24.2,
              10.9
            ]
          },
          "joints": [
            [
              0.0,
              0.0,
              0.0
            ],
            [
              0.0257,
              -0.0159,
              0.0312
            ],
            [
              0.0243,
              -0.028,
              0.0585
            ],
            [
              0.0096,
              -0.0464,
              0.09
            ],
            [
              -0.0189,
              -0.0515,
              0.1022
            ],
            [
              0.0278,
              -0.0072,
              0.102
            ],
            [
              0.0294,
              -0.0016,
              0.1315
            ],
            [
              0.0317,
              0.0007,
              0.1546
            ],
            [
              0.0384,
              -0.0138,
              0.1769
            ],
            [
              -0.0,
              0.0,
              0.1009
            ],
            [
              -0.0106,
              0.013,
              0.1406
            ],
            [
              -0.0122,
              0.0095,
              0.1679
            ],
            [
              -0.0116,
              0.0055,
              0.1918
            ],
            [
              -0.0248,
              -0.0027,
              0.0954
            ],
            [
              -0.0384,
              0.0015,
              0.1286
            ],
            [
              -0.0487,
              -0.0056,
              0.1539
            ],
            [
              -0.053,
              -0.0139,
              0.1718
            ],
            [
              -0.0397,
              -0.0072,
              0.0771
            ],
            [
              -0.0581,
              -0.0048,
              0.0968
            ],
            [
              -0.0679,
              -0.0098,
              0.1162
            ],
            [
              -0.0768,
              -0.0161,
              0.1295
            ]
          ],
          "wristRotation": [
            0.2346,
            -0.8166,
            -0.522,
            0.0747
          ]
        },
        "right": {
          "targetAngles": {
            "thumb": [
              28.5,
              33.2
            ],
            "index": [
              1.4,
              -4.9,
              38.5
            ],
            "middle": [
              -16.6,
              30.6,
              -15.2
            ],
            "ring": [
              -12.8,
              11.8,
              12.4
            ],
            "pinky": [
              -24.5,
              12.8,
              13.6
            ]
          },
          "joints": [
            [
              0.0,
              0.0,
              0.0
            ],
            [
              -0.0231,
              -0.0137,
              0.0314
            ],
            [
              -0.0246,
              -0.03,
              0.0646
            ],
            [
              -0.0067,
              -0.0512,
              0.0963
            ],
            [
              0.0189,
              -0.0569,
              0.112
            ],
            [
              -0.0226,
              -0.0079,
              0.1064
            ],
            [
              -0.0291,
              -0.01,
              0.1338
            ],
            [
              -0.0325,
              -0.0102,
              0.1531
            ],
            [
              -0.031,
              -0.0278,
              0.1763
            ],
            [
              -0.0,
              0.0,